<?xml version="1.0" encoding="UTF-8"?>
<!DOCTYPE hospital SYSTEM "hospital.dtd">

<hospital nombre="Hospital Central">
    <profesionales>
        <auxiliares>
            <auxiliar id="1" nombre="Pepito" apellidos="Sanchez Sanchez" seccion="CardiologÃ­a" />
        </auxiliares>
        <cirujanos>
            <cirujano>
                <id>2</id>
                <nombre>Juanito</nombre>
                <apellidos>Perez Sanchez</apellidos>
                <seccion>Traumatologia</seccion>
            </cirujano>
        </cirujanos>
        <enfermeros>
            <enfermero id="3">
                <nombre>Margarita</nombre>
                <apellidos>Lopez Gil</apellidos>
                <seccion>Cuidados Intensivos</seccion>
            </enfermero>
        </enfermeros>
        <doctores>
            <doctor id="4" nombre="Luisito" licenciado="Si">
                <apellidos>Martinez Martinez</apellidos>
                <seccion>Pediatria</seccion>
            </doctor>
        </doctores>
    </profesionales>
    <pacientes>
        <paciente DNI="12837128">
            <fichaMedica>Todo va perfecto, el paciente esta de 10.</fichaMedica>
        </paciente>
    </pacientes>
</hospital>